{
  "schema_version": "1.0",
  "source": "SEC EDGAR and Longbridge",
  "source_timestamp_utc": "2026-07-20T12:29:00Z",
  "received_at_utc": "2026-07-20T12:31:00Z",
  "confidence": 1.0,
  "raw_ref": "fixture://news-scan/2026-07-20",
  "trading_date": "2026-07-20",
  "events": [
    {
      "event_id": "news_aapl_20260720_1",
      "symbols": ["AAPL"],
      "headline": "Apple files a material current report",
      "event_at_utc": "2026-07-20T12:30:00Z",
      "severity": "MEDIUM",
      "source": "SEC EDGAR",
      "source_timestamp_utc": "2026-07-20T12:29:00Z",
      "received_at_utc": "2026-07-20T12:31:00Z",
      "confidence": 1.0,
      "raw_ref": "fixture://sec-edgar/aapl-8k-20260720"
    }
  ]
}
